{
  "id": "dev.exemple.high-contrast",
  "name": { "fr": "Contraste élevé", "en": "High contrast" },
  "version": "1.0.0",
  "description": {
    "fr": "Un thème à fort contraste, clair et sombre.",
    "en": "A high-contrast theme, light and dark."
  },
  "license": "MIT",
  "escouade": { "api": "1", "min": "2.1.0" },
  "contributes": {
    "themes": [
      {
        "id": "high-contrast",
        "name": { "fr": "Contraste élevé", "en": "High contrast" },
        "light": { "--bg": "#ffffff", "--text": "#000000", "--accent": "#0040c0" },
        "dark": { "--bg": "#000000", "--text": "#ffffff", "--accent": "#ffd400" }
      }
    ]
  }
}
