{
  "$schema": "https://escouade.dev/schemas/plugin-1.json",
  "id": "dev.exemple.discord",
  "name": "Discord",
  "version": "1.0.0",
  "description": {
    "fr": "Les tickets à tester et les agents qui attendent, dans un salon Discord : un webhook, sans code.",
    "en": "Tickets to test and agents waiting, in a Discord channel: a webhook, no code."
  },
  "author": { "name": "Escouade", "url": "https://escouade.dev" },
  "license": "MIT",
  "escouade": { "api": "1", "min": "2.1.0" },
  "permissions": {
    "events": ["ticket.column", "agent.status"],
    "network": ["discord.com"],
    "secrets": ["webhook"]
  },
  "contributes": {
    "secrets": [{ "key": "webhook", "title": { "fr": "Adresse du webhook Discord", "en": "Discord webhook URL" } }],
    "webhooks": [
      {
        "url": "{{secrets.webhook}}",
        "events": ["ticket.column"],
        "when": { "data.to": "review" },
        "body": { "content": "🧪 **{{ticket.key}}** to test: {{ticket.title}} ({{project.name}})" }
      },
      {
        "url": "{{secrets.webhook}}",
        "events": ["agent.status"],
        "when": { "data.status": "waiting" },
        "body": { "content": "✋ **{{agent.name}}** waits for you ({{project.name}})" }
      }
    ]
  }
}
